[
    {
        "uniqueID": "mlx-community/Mistral-7B-Instruct-v0.1-4bit-mlx",
        "name": "Mistral-7B-Instruct-v0.1 MLX 4bit",
        "description": "The Mistral-7B-Instruct-v0.1 Large Language Model (LLM) is a instruct fine-tuned version of the Mistral-7B-v0.1 generative text model using a variety of publicly available conversation datasets.",
        "parameters": "7B",
        "context": "4k",
        "architecture": "MLX",
        "huggingface_repo": "mlx-community/Mistral-7B-Instruct-v0.1-4bit-mlx",
        "transformers_version": "4.34.0.dev0",
        "license": "Apache 2.0",
        "logo": "https://docs.mistral.ai/img/logo.svg",
        "author": {
            "name": "Mistral AI",
            "url": "https://docs.mistral.ai/",
            "blurb": ""
        },
        "resources": {
            "canonicalUrl": "https://huggingface.co/mistralai/Mistral-7B-v0.1",
            "downloadUrl": "https://huggingface.co/mistralai/Mistral-7B-v0.1",
            "paperUrl": "?"
        }
    }
]